<?xml version="1.0" encoding="UTF-8"?>
<tsl author="Erik van der Weijden" id="ticket/InitDeleteOrganization" notes="" repository="$Id$" xmlns="http://www.dexels.com/navascript"
    xmlns:xsi="http://www.w3.org/2001/XMLSchema-instance" xsi:schemaLocation="http://www.dexels.com/navascript http://www.dexels.com/schema/navascript.xsd ">
    <methods>
        <method name="ticket/ProcessDeleteOrganization" />
    </methods>
    <message name="Organization">

        <property name="OrganizationId" type="selection" direction="in">
            <option name="-" value="-1" selected="1" />
        </property>
        <map object="com.dexels.navajo.adapter.SQLMap">
            <field name="datasource">
                <expression value="'ticket'" />
            </field>
            <field name="query">
                <expression xml:space="preserve">
                  SELECT organizationid, organizationname FROM organization
                </expression>
            </field>
            <property name="OrganizationId" type="selection" direction="in">
                <map ref="resultSet">
                    <property name="name">
                        <expression value="$columnValue('organizationname')" />
                    </property>
                    <property name="value">
                        <expression value="$columnValue('organizationid')" />
                    </property>
                </map>
            </property>
        </map>
    </message>
</tsl>